review_id,customer_id,product_id,review_stars,review_text,review_date
REV00001,CUST0029,PROD0019,5,Movie develop notice trouble experience else mention.,2025-07-05
REV00002,CUST0010,PROD0026,5,Foot reality last those card read.,2025-05-01
REV00003,CUST0085,PROD0003,4,Thousand top citizen analysis.,2025-08-22
REV00004,CUST0039,PROD0038,4,Education sea just ball cause year.,2025-02-08
REV00005,CUST0068,PROD0050,4,Drive of identify history we.,2025-03-17
REV00006,CUST0021,PROD0036,5,Onto table pattern sound development.,2025-10-11
REV00007,CUST0009,PROD0028,5,Enjoy mind force daughter.,2025-10-12
REV00008,CUST0046,PROD0042,1,Citizen speak watch sell provide the debate especially.,2025-07-24
REV00009,CUST0002,PROD0011,5,Card side option American popular.,2025-10-22
REV00010,CUST0001,PROD0034,3,Strategy marriage religious at strong memory.,2025-01-07
REV00011,CUST0081,PROD0001,4,Up ok well tonight task theory system.,2025-12-08
REV00012,CUST0072,PROD0007,1,Her assume like serve.,2025-03-01
REV00013,CUST0016,PROD0042,1,Their color happy second institution soon.,2025-07-28
REV00014,CUST0089,PROD0039,3,About public your collection figure tend.,2025-11-20
REV00015,CUST0031,PROD0021,3,Raise goal different become hold executive.,2025-01-18
REV00016,CUST0032,PROD0005,3,Better hundred eye result tree.,2025-04-15
REV00017,CUST0026,PROD0022,4,Professor them option billion home why clear.,2025-09-13
REV00018,CUST0072,PROD0050,2,Because TV involve.,2025-05-11
REV00019,CUST0054,PROD0036,2,I box stock development too decision Mr.,2025-11-25
REV00020,CUST0010,PROD0011,3,Be begin individual among.,2025-06-24
REV00021,CUST0051,PROD0036,5,Hard doctor positive better ever do.,2025-03-14
REV00022,CUST0097,PROD0037,3,Start dinner military I mind either film free.,2025-09-26
REV00023,CUST0016,PROD0035,5,Four mean itself up about face word want.,2025-07-20
REV00024,CUST0089,PROD0026,1,Thousand power front happy himself manager back.,2025-07-28
REV00025,CUST0031,PROD0028,5,Character far million painting ground cold although.,2025-10-08
REV00026,CUST0067,PROD0026,1,Prove total prove.,2025-12-05
REV00027,CUST0001,PROD0008,4,Purpose stage performance scene real drop.,2025-04-27
REV00028,CUST0097,PROD0040,5,Court bag much street phone road.,2024-12-24
REV00029,CUST0075,PROD0037,5,Both theory scientist available.,2025-03-31
REV00030,CUST0074,PROD0003,1,Training enough couple me.,2025-07-15
REV00031,CUST0024,PROD0044,3,Always within than sell human.,2025-09-02
REV00032,CUST0031,PROD0002,4,Ago save meet prevent able fine customer read.,2025-03-31
REV00033,CUST0066,PROD0016,1,Remain fish suggest.,2025-06-15
REV00034,CUST0047,PROD0017,4,Instead open cup.,2024-12-22
REV00035,CUST0020,PROD0039,3,Eat understand special.,2025-03-04
REV00036,CUST0080,PROD0005,1,Continue that go sort they time.,2025-03-25
REV00037,CUST0036,PROD0029,1,Beat spend push statement player bill.,2025-02-23
REV00038,CUST0037,PROD0043,5,Brother over oil.,2025-07-14
REV00039,CUST0046,PROD0004,4,Other debate let option.,2024-12-12
REV00040,CUST0017,PROD0021,4,Western box father hair seek.,2025-07-16
REV00041,CUST0032,PROD0034,1,Debate would agreement.,2025-11-08
REV00042,CUST0073,PROD0034,4,Back pass hour bar.,2025-01-17
REV00043,CUST0083,PROD0004,4,Human piece guess approach expert.,2025-07-26
REV00044,CUST0062,PROD0005,2,Rather card try form free.,2025-10-30
REV00045,CUST0063,PROD0044,3,Design pressure different ball many.,2025-08-11
REV00046,CUST0015,PROD0034,1,Cover week speech spend well stay sport decade.,2025-05-08
REV00047,CUST0076,PROD0039,3,Trouble certainly story laugh relationship.,2025-04-30
REV00048,CUST0035,PROD0009,3,In reach worker hand something address heavy.,2024-12-24
REV00049,CUST0098,PROD0048,2,Between must scene note.,2025-03-01
REV00050,CUST0005,PROD0014,5,Discover mother easy star.,2025-11-17
REV00051,CUST0076,PROD0005,2,Protect glass week suggest benefit product.,2025-06-05
REV00052,CUST0097,PROD0045,1,Ten stage base what region contain.,2025-06-13
REV00053,CUST0082,PROD0025,1,Seven before north room food whole rock.,2025-10-12
REV00054,CUST0095,PROD0035,1,Customer partner hold difference institution.,2025-05-01
REV00055,CUST0073,PROD0006,1,Environmental risk father this step feel wide.,2025-07-26
REV00056,CUST0054,PROD0016,1,Price western particularly call seem lead evidence.,2025-02-01
REV00057,CUST0074,PROD0009,1,Ahead seven town part fall.,2025-09-08
REV00058,CUST0051,PROD0035,1,Policy put political social fact.,2025-11-12
REV00059,CUST0077,PROD0012,3,Point past near respond by condition.,2025-03-24
REV00060,CUST0078,PROD0013,1,Watch task exactly couple rest never purpose.,2025-09-09
REV00061,CUST0072,PROD0039,1,Market board responsibility describe war put.,2024-12-22
REV00062,CUST0090,PROD0004,4,Really quality in available.,2025-01-01
REV00063,CUST0036,PROD0034,3,Career yes this.,2025-03-25
REV00064,CUST0057,PROD0041,1,So huge on design beautiful conference.,2025-03-31
REV00065,CUST0039,PROD0031,1,Minute anything idea knowledge.,2025-06-02
REV00066,CUST0032,PROD0044,1,At also argue building base strong charge talk.,2025-10-31
REV00067,CUST0066,PROD0044,3,The discuss subject where.,2025-02-12
REV00068,CUST0039,PROD0001,1,Decision song today hour ground five by.,2025-05-03
REV00069,CUST0086,PROD0025,5,Serious increase minute president water indicate free whether.,2025-02-10
REV00070,CUST0008,PROD0004,5,Identify know agreement kind or ago central.,2025-05-24
REV00071,CUST0067,PROD0033,4,Investment politics analysis.,2025-03-24
REV00072,CUST0042,PROD0014,1,Evening force sure direction.,2025-08-25
REV00073,CUST0014,PROD0041,1,Group indeed ago investment parent far.,2025-06-12
REV00074,CUST0042,PROD0004,3,Within wish have available strong.,2025-01-20
REV00075,CUST0076,PROD0006,5,Current street own experience away more.,2025-11-25
REV00076,CUST0100,PROD0039,3,Call despite then wide.,2025-04-22
REV00077,CUST0040,PROD0034,4,Up image institution church.,2025-01-04
REV00078,CUST0079,PROD0019,1,Painting his use give.,2025-01-28
REV00079,CUST0007,PROD0027,4,Billion body hear military.,2025-04-01
REV00080,CUST0030,PROD0027,2,Their off success happy watch.,2025-07-03
REV00081,CUST0070,PROD0026,5,Me store story up respond begin.,2025-08-20
REV00082,CUST0077,PROD0018,1,Wrong learn visit political stay debate season.,2025-02-05
REV00083,CUST0031,PROD0011,3,Fear might compare son.,2025-08-02
REV00084,CUST0082,PROD0048,3,Hope pay line eight good daughter pretty budget.,2025-06-08
REV00085,CUST0051,PROD0007,3,Social themselves professional television manager institution.,2025-05-31
REV00086,CUST0042,PROD0021,1,Wish movie I take.,2024-12-31
REV00087,CUST0066,PROD0007,3,Deep represent allow participant stay.,2025-10-23
REV00088,CUST0005,PROD0015,4,Throw admit treat.,2025-05-11
REV00089,CUST0016,PROD0046,4,Oil people wrong set check wish accept fight.,2025-08-03
REV00090,CUST0061,PROD0021,2,Yes he fine probably begin sea situation.,2025-05-11
REV00091,CUST0016,PROD0026,1,Machine create toward purpose officer race.,2025-11-12
REV00092,CUST0091,PROD0015,2,Majority decide finally people like pay style.,2025-06-09
REV00093,CUST0021,PROD0026,3,Arrive network born threat across.,2025-01-27
REV00094,CUST0037,PROD0023,1,Before conference ever scientist best happy week.,2024-12-20
REV00095,CUST0083,PROD0007,2,Suggest song wonder drug.,2025-02-01
REV00096,CUST0001,PROD0003,2,Section or tell name professor no.,2025-02-07
REV00097,CUST0001,PROD0004,4,Both involve theory.,2025-02-02
REV00098,CUST0005,PROD0049,4,Fact financial such individual apply expert.,2025-01-30
REV00099,CUST0075,PROD0002,3,Wait phone moment move nature ball.,2025-07-13
REV00100,CUST0067,PROD0042,5,High me my will even.,2024-12-10
REV00101,CUST0010,PROD0009,4,Particularly throw American health.,2025-04-14
REV00102,CUST0024,PROD0004,3,Return song effort west hear site.,2025-11-04
REV00103,CUST0080,PROD0042,3,Election remain view new.,2025-03-31
REV00104,CUST0046,PROD0003,2,Bad price southern particular.,2025-02-07
REV00105,CUST0047,PROD0025,2,Staff best carry stay table seven.,2025-06-23
REV00106,CUST0100,PROD0019,3,Region company production unit thus.,2025-02-18
REV00107,CUST0090,PROD0031,3,Would surface field environment to all a.,2025-08-17
REV00108,CUST0090,PROD0020,2,Stage main finish entire.,2025-08-08
REV00109,CUST0033,PROD0019,5,Easy report involve case natural raise so.,2025-06-23
REV00110,CUST0032,PROD0046,3,Case discussion after.,2025-07-23
REV00111,CUST0079,PROD0023,2,Onto administration security explain spend hair go.,2025-04-18
REV00112,CUST0049,PROD0006,5,Development peace people consumer knowledge ready own.,2025-07-27
REV00113,CUST0036,PROD0042,4,Eat body number role push future.,2025-06-14
REV00114,CUST0023,PROD0048,1,Life about especially structure decide hotel with pattern.,2025-11-30
REV00115,CUST0091,PROD0011,3,Decade first receive black employee compare successful.,2025-03-30
REV00116,CUST0028,PROD0045,3,Goal off technology west.,2025-07-17
REV00117,CUST0009,PROD0021,4,Significant bag morning church.,2025-09-05
REV00118,CUST0021,PROD0008,1,Military eight town list alone service reveal.,2025-01-21
REV00119,CUST0005,PROD0023,1,Technology start sense accept national.,2025-09-08
REV00120,CUST0036,PROD0001,1,Information baby rate that herself home key.,2025-06-07
REV00121,CUST0004,PROD0036,3,Type nearly partner much defense up price.,2025-07-14
REV00122,CUST0024,PROD0011,3,Head city stop husband large.,2025-01-06
REV00123,CUST0022,PROD0015,4,Yeah agree particularly Republican affect.,2025-09-18
REV00124,CUST0003,PROD0045,2,Truth price fear baby civil contain man free.,2025-05-05
REV00125,CUST0066,PROD0002,3,Reveal him water.,2025-07-14
REV00126,CUST0016,PROD0042,1,Moment police car price decide shake say.,2025-08-23
REV00127,CUST0070,PROD0040,4,Find more character same true.,2025-03-28
REV00128,CUST0023,PROD0029,2,Indeed scene investment board authority.,2025-08-12
REV00129,CUST0040,PROD0009,2,Necessary discuss or present peace true more.,2025-09-13
REV00130,CUST0057,PROD0045,1,Just theory protect right seat.,2025-03-29
REV00131,CUST0090,PROD0050,4,Likely evening catch point oil plant different.,2025-11-30
REV00132,CUST0095,PROD0032,5,Country view above house walk.,2025-03-07
REV00133,CUST0099,PROD0037,1,Compare available generation study film.,2025-06-22
REV00134,CUST0004,PROD0042,1,Second friend give fill trade perform.,2024-12-14
REV00135,CUST0075,PROD0030,2,Mission morning eat concern.,2025-01-10
REV00136,CUST0092,PROD0001,1,Himself single drug area.,2025-01-18
REV00137,CUST0056,PROD0003,5,Road method trouble road challenge fear.,2025-02-25
REV00138,CUST0019,PROD0018,4,South society consumer herself between foreign relate final.,2025-11-29
REV00139,CUST0003,PROD0041,3,Crime computer find turn to itself past.,2025-03-02
REV00140,CUST0068,PROD0032,4,Wait responsibility happen opportunity business character political.,2024-12-29
REV00141,CUST0096,PROD0018,5,Green near structure radio.,2025-11-17
REV00142,CUST0017,PROD0024,2,Off media general ground assume development should.,2025-07-06
REV00143,CUST0071,PROD0005,5,Wrong bar billion little.,2025-09-30
REV00144,CUST0016,PROD0045,5,Institution economy around money over prove state.,2025-06-14
REV00145,CUST0079,PROD0004,4,Forward lose would tonight black some.,2025-10-17
REV00146,CUST0015,PROD0028,2,Adult challenge easy history until agent.,2025-11-10
REV00147,CUST0027,PROD0019,2,Beyond he society.,2025-06-14
REV00148,CUST0073,PROD0032,1,Research happen economic somebody.,2025-06-06
REV00149,CUST0098,PROD0031,1,Than bill himself himself any.,2025-02-14
REV00150,CUST0087,PROD0049,5,Despite picture space how total recent.,2025-01-23
REV00151,CUST0056,PROD0013,1,Nation game image charge scene cause.,2025-08-09
REV00152,CUST0075,PROD0045,1,Particularly new candidate end size agreement.,2025-02-14
REV00153,CUST0036,PROD0011,3,Produce Mr son beyond lay when four.,2025-08-14
REV00154,CUST0096,PROD0008,1,Enough center catch lead.,2025-02-25
REV00155,CUST0072,PROD0037,5,Reflect director thing attack now southern red table.,2025-05-03
REV00156,CUST0025,PROD0016,3,Network already ago charge.,2025-07-19
REV00157,CUST0027,PROD0047,2,Democratic usually claim old.,2024-12-29
REV00158,CUST0081,PROD0031,5,Seat main such action eat.,2025-06-04
REV00159,CUST0040,PROD0010,3,Place management education learn over issue attention.,2025-02-03
REV00160,CUST0049,PROD0047,1,Threat interview yes toward knowledge.,2025-02-25
REV00161,CUST0092,PROD0004,1,Never itself third space sort win find eight.,2025-10-08
REV00162,CUST0007,PROD0040,1,War course as hotel hope list reflect decade.,2025-04-29
REV00163,CUST0079,PROD0007,3,From couple herself need gas that.,2025-07-03
REV00164,CUST0051,PROD0034,3,Court within several former.,2025-01-12
REV00165,CUST0062,PROD0032,5,Pass environment Democrat great economic poor listen.,2025-05-30
REV00166,CUST0097,PROD0013,4,Financial draw either.,2025-01-20
REV00167,CUST0064,PROD0013,1,Ready explain senior modern.,2025-11-21
REV00168,CUST0009,PROD0048,4,Cut then politics take kid.,2025-06-28
REV00169,CUST0089,PROD0044,4,Whom away receive particular lawyer explain whose enjoy.,2025-11-24
REV00170,CUST0036,PROD0004,1,Write whose detail at she second.,2025-11-18
REV00171,CUST0004,PROD0028,3,Treatment truth place people magazine kitchen despite.,2025-11-08
